{
  "$schema": "https://json-schema.org/draft/2020-12/schema",
  "$id": "https://schemas.nexusos.dev/v1alpha1/secrets-bundle-manifest.schema.json",
  "title": "nexus.secrets.bundle public manifest (v1alpha1)",
  "description": "PUBLIC manifest of an encrypted, single-use secrets bundle. TARGET-STATE contract. This schema describes ONLY metadata about the bundle. It MUST NOT contain any secret value, ciphertext payload, or plaintext key material. Secret values are encrypted client-side to the instance public key and travel out of band. See ADR-0005.",
  "x-nexus-contract-version": "v1alpha1",
  "type": "object",
  "additionalProperties": false,
  "required": ["apiVersion", "kind", "bundle_id", "recipient", "entries", "expires_at", "single_use"],
  "properties": {
    "apiVersion": { "const": "nexus.io/v1alpha1" },
    "kind": { "const": "SecretsBundleManifest" },
    "bundle_id": { "type": "string", "minLength": 8 },
    "recipient": {
      "type": "object",
      "additionalProperties": false,
      "required": ["instance_id", "public_key_id"],
      "description": "Instance the bundle was encrypted for. The Hub never holds the private key.",
      "properties": {
        "instance_id": { "$ref": "common.defs.schema.json#/$defs/InstanceId" },
        "public_key_id": { "type": "string" }
      }
    },
    "encryption": {
      "type": "object",
      "additionalProperties": false,
      "required": ["scheme"],
      "properties": {
        "scheme": { "type": "string", "enum": ["age", "hpke", "jwe"] },
        "encrypted_in_browser": { "type": "boolean", "const": true }
      }
    },
    "entries": {
      "type": "array",
      "description": "Descriptors of what the bundle carries. Names and target services only; NEVER values.",
      "minItems": 1,
      "items": {
        "type": "object",
        "additionalProperties": false,
        "required": ["ref_name", "service"],
        "properties": {
          "ref_name": {
            "type": "string",
            "description": "Logical reference name (e.g. ANTHROPIC_API_KEY). A NAME, not a value.",
            "pattern": "^[A-Z][A-Z0-9_]*$"
          },
          "service": { "type": "string", "description": "Provider/service the secret authenticates to." },
          "acquired_via": { "type": "string", "enum": ["oauth", "device_flow", "vault_reference", "manual_last_resort"] }
        },
        "not": {
          "anyOf": [
            { "required": ["value"] },
            { "required": ["secret"] },
            { "required": ["plaintext"] },
            { "required": ["ciphertext"] }
          ]
        }
      }
    },
    "expires_at": {
      "$ref": "common.defs.schema.json#/$defs/Timestamp",
      "description": "Short expiry. After import or expiry the bundle is invalidated and deleted."
    },
    "single_use": { "type": "boolean", "const": true },
    "invalidated_after_import": { "type": "boolean", "const": true }
  }
}
