{
  "apiVersion": "nexus.io/v1alpha1",
  "kind": "SecretsBundleManifest",
  "bundle_id": "sb_7c1e9a4f20b8",
  "recipient": {
    "instance_id": "inst_costahomes01",
    "public_key_id": "inst-costahomes01-enc-2026"
  },
  "encryption": {
    "scheme": "age",
    "encrypted_in_browser": true
  },
  "entries": [
    { "ref_name": "OPENAI_API_KEY", "service": "openai", "acquired_via": "manual_last_resort" },
    { "ref_name": "ANTHROPIC_API_KEY", "service": "anthropic", "acquired_via": "oauth" }
  ],
  "expires_at": "2026-07-19T12:30:00Z",
  "single_use": true,
  "invalidated_after_import": true
}
